{
  "id": "claim_tiwi_mission_suppression_fallon",
  "subject_type": "Tradition",
  "subject_id": "trad_tiwi_pukumani",
  "statement": "Fr. John Fallon, Catholic mission on Bathurst Island (1958-1970), shook and destroyed Pukumani (sacred burial) poles belonging to Minnipinni (Thomas Woody's father), continuing after being asked to stop. Fallon himself later described his motive as being \"fired by zeal to convert souls and destroy idolatrous practices\" and expressed regret; the episode reportedly triggered a rethink of Catholic mission strategy on the Tiwi Islands.",
  "claim_tier": "OBSERVATION",
  "related_observation_id": null,
  "date_semantics": "EVENT_DATE",
  "date": {
    "earliest": 1958,
    "latest": 1970,
    "precision": "DECADE"
  },
  "zoom_min": "Z4",
  "zoom_max": "Z7",
  "region": [
    "Australia"
  ],
  "evidence_types": [
    "WRITTEN_PRIMARY"
  ],
  "confidence": "HIGH",
  "scholarly_disagreement": null,
  "sources": [
    {
      "type": "SECONDARY",
      "citation": "ABC Religion & Ethics, \"Tiwi Christianity: Aboriginal Histories, Catholic Mission, and a Su[bversive Faith].\"",
      "author": null,
      "year": null,
      "venue": null,
      "contemporary_with_event": null,
      "independent_corroboration": null,
      "verified_by": "research-agent (WebSearch)",
      "verified_date": "2026-09-01",
      "verification_method": "CONVERGING_SECONDARY",
      "access_note": null
    }
  ],
  "interpretations": [],
  "does_not_demonstrate": [],
  "adversarial_counter": null,
  "status": "verified",
  "notes": null
}
