{
  "id": "claim_arrernte_gender_source_bias",
  "subject_type": "GenderSystem",
  "subject_id": "gs_arrernte",
  "statement": "T.G.H. Strehlow recorded a vast corpus of Arrernte men's ceremonial songs in the 1950s (feeding Songs of Central Australia, 1971) but recorded no Arrernte women's songs. Significant recording of Arrernte women's songs did not occur until the 1990s, undertaken by Arrernte custodian Margaret Kemarre (M.K.) Turner together with linguist Jennifer Green. This is an observation about what got recorded and by whom (P13: not by itself a claim about suppression or content), directly explaining several UNKNOWN dimensions in this GenderSystem record.",
  "claim_tier": "OBSERVATION",
  "related_observation_id": null,
  "date_semantics": null,
  "date": null,
  "zoom_min": "Z4",
  "zoom_max": "Z7",
  "region": [
    "Australia"
  ],
  "evidence_types": [
    "WRITTEN_PRIMARY"
  ],
  "confidence": "HIGH",
  "scholarly_disagreement": null,
  "sources": [
    {
      "type": "SECONDARY",
      "citation": "Turpin, Myfany. \"Finding Arrernte Songs.\" University of Sydney / ANU Open Research repository.",
      "author": "Myfany Turpin",
      "year": null,
      "venue": null,
      "contemporary_with_event": null,
      "independent_corroboration": null,
      "verified_by": "research-agent (WebSearch)",
      "verified_date": "2026-09-01",
      "verification_method": "CONVERGING_SECONDARY",
      "access_note": null
    }
  ],
  "interpretations": [],
  "does_not_demonstrate": [],
  "adversarial_counter": null,
  "status": "verified",
  "notes": null
}
